<?xml version="1.0" encoding="UTF-8"?>
<!DOCTYPE manifest SYSTEM "../common/src/main/resources/contracts/manifest/manifest.dtd">
<manifest xmlns:xsi="http://www.w3.org/2001/XMLSchema-instance"
          xsi:noNamespaceSchemaLocation="../common/src/main/resources/contracts/manifest/manifest.xsd">

    <droneId>DRONE-001</droneId>
    <operatorId>OP-001</operatorId>
    <startTime>2026-01-01T10:00:00Z</startTime>
    <endTime>2026-01-01T10:00:20Z</endTime>

    <photos>
        <photo>
            <fileKey>photo-0001.jpg</fileKey>
            <takenAt>2026-01-01T10:00:00Z</takenAt>
            <latitude>55.755800</latitude>
            <longitude>37.617300</longitude>
            <altitude>120.0</altitude>
        </photo>

        <photo>
            <fileKey>photo-0002.jpg</fileKey>
            <takenAt>2026-01-01T10:00:05Z</takenAt>
            <latitude>55.755800</latitude>
            <longitude>37.627300</longitude>
            <altitude>121.0</altitude>
        </photo>

        <photo>
            <fileKey>photo-0003.jpg</fileKey>
            <takenAt>2026-01-01T10:00:10Z</takenAt>
            <latitude>55.755800</latitude>
            <longitude>37.637300</longitude>
            <altitude>122.0</altitude>
        </photo>

        <photo>
            <fileKey>photo-0004.jpg</fileKey>
            <takenAt>2026-01-01T10:00:15Z</takenAt>
            <latitude>55.755800</latitude>
            <longitude>37.647300</longitude>
            <altitude>123.0</altitude>
        </photo>
    </photos>

</manifest>
